snomed_code,icd10_code,icd10_description
195185009,I63.0,Cerebral infarction due to thrombosis of precerebral arteries
195186005,I63.1,Cerebral infarction due to embolism of precerebral arteries
195189003,I63.3,Cerebral infarction due to thrombosis of cerebral arteries
195209007,G46.0,Middle cerebral artery syndrome
195211003,G46.2,Posterior cerebral artery syndrome
254199006,Q82.0,Hereditary lymphedema
254264002,Q90.2,"Trisomy 21, translocation"
254284003,Q98,"Other sex chromosome abnormalities, male phenotype, not elsewhere classified"
195677001,J03.01,Acute recurrent streptococcal tonsillitis
195725001,J20.3,Acute bronchitis due to coxsackievirus
195727009,J20.5,Acute bronchitis due to respiratory syncytial virus
195729007,J20.7,Acute bronchitis due to echovirus
195911009,B01.2,Varicella pneumonia
194424005,H90.3,"Sensorineural hearing loss, bilateral"
285235009,S20.213S,"Contusion of bilateral front wall of thorax, sequela"
285236005,S40.842S,"External constriction of left upper arm, sequela"
194457007,G09,Sequelae of inflammatory diseases of central nervous system
194727002,I34.2,Nonrheumatic mitral (valve) stenosis
194788005,I15.2,Hypertension secondary to endocrine disorders
194849004,I25.5,Ischemic cardiomyopathy
194987006,I35.2,Nonrheumatic aortic (valve) stenosis with insufficiency
285261008,R45.85,Homicidal and suicidal ideations
285365001,M79.676,Pain in unspecified toe(s)
18101008,R19.12,Hyperactive bowel sounds
254050009,Q77.2,Short rib syndrome
284197002,T20.55,Corrosion of first degree of scalp [any part]
284200001,T20.511,"Corrosion of first degree of right ear [any part, except ear drum]"
284206007,T20.53,Corrosion of first degree of chin
284216004,T21.51,Corrosion of first degree of chest wall
284224009,T21.55,Corrosion of first degree of buttock
194990000,I36.1,Nonrheumatic tricuspid (valve) insufficiency
194991001,I36.0,Nonrheumatic tricuspid (valve) stenosis
194992008,I36.2,Nonrheumatic tricuspid (valve) stenosis with insufficiency
194995005,I37.1,Nonrheumatic pulmonary valve insufficiency
254268004,Q91.6,"Trisomy 13, translocation"
254269007,Q92.0,"Whole chromosome trisomy, nonmosaicism (meiotic nondisjunction)"
254270008,Q92.1,"Whole chromosome trisomy, mosaicism (mitotic nondisjunction)"
254277006,Q97,"Other sex chromosome abnormalities, female phenotype, not elsewhere classified"
254285002,Q98.6,Male with structurally abnormal sex chromosome
195033009,D86.85,Sarcoid myocarditis
195105007,I47.0,Re-entry ventricular arrhythmia
195003002,I08.2,Rheumatic disorders of both aortic and tricuspid valves
195004008,I08.1,Rheumatic disorders of both mitral and tricuspid valves
254283009,Q97.2,"Mosaicism, lines with various numbers of X chromosomes"
195083004,I49.0,Ventricular fibrillation and flutter
195160000,I60.5,Nontraumatic subarachnoid hemorrhage from vertebral artery
195176009,I62.0,Nontraumatic subdural hemorrhage
195212005,G46.3,Brain stem stroke syndrome
195213000,G46.4,Cerebellar stroke syndrome
195230003,I63.6,"Cerebral infarction due to cerebral venous thrombosis, nonpyogenic"
195233001,I66.13,Occlusion and stenosis of bilateral anterior cerebral arteries
195234007,I66.22,Occlusion and stenosis of left posterior cerebral artery
195240000,I69.0,Sequelae of nontraumatic subarachnoid hemorrhage
195241001,I69.1,Sequelae of nontraumatic intracerebral hemorrhage
195363007,M30.2,Juvenile polyarteritis
195405004,I80.22,Phlebitis and thrombophlebitis of popliteal vein
254645002,C45.0,Mesothelioma of pleura
254651007,C44.42,Squamous cell carcinoma of skin of scalp and neck
195720006,J20.2,Acute bronchitis due to streptococcus
195200006,G45.1,Carotid artery syndrome (hemispheric)
195235008,I66.3,Occlusion and stenosis of cerebellar arteries
195243003,I69.3,Sequelae of cerebral infarction
285302001,N47.4,Benign cyst of prepuce
285391000,S76.211,"Strain of adductor muscle, fascia and tendon of right thigh"
195506001,I95.0,Idiopathic hypotension
195726000,J20.4,Acute bronchitis due to parainfluenza virus
195728004,J20.6,Acute bronchitis due to rhinovirus
195810009,J37,Chronic laryngitis and laryngotracheitis
196017002,J65,Pneumoconiosis associated with tuberculosis
254701007,C44.91,"Basal cell carcinoma of skin, unspecified"
196040003,O74.0,Aspiration pneumonitis due to anesthesia during labor and delivery
196051003,J70.4,"Drug-induced interstitial lung disorders, unspecified"
196053000,J70.3,Chronic drug-induced interstitial lung disorders
195929004,J11.2,Influenza due to unidentified influenza virus with gastrointestinal manifestations
195953005,J41.8,Mixed simple and mucopurulent chronic bronchitis
254830006,D17,Benign lipomatous neoplasm
198286004,N82.3,Fistula of vagina to large intestine
284549007,S61.411,Laceration without foreign body of right hand
284554003,S32.311,Displaced avulsion fracture of right ilium
284572009,S17.0,Crushing injury of larynx and trachea
255195007,D21.0,"Benign neoplasm of connective and other soft tissue of head, face and neck"
198302001,N83.321,Acquired atrophy of right fallopian tube
253737007,Q31.5,Congenital laryngomalacia
253748000,Q34.0,Anomaly of pleura
253822004,Q50.2,Congenital torsion of ovary
253883006,Q61.02,Congenital multiple renal cysts
253900005,Q64.2,Congenital posterior urethral valves
254044004,Q78.6,Multiple congenital exostoses
198336007,N88,Other noninflammatory disorders of cervix uteri
198285000,N82.2,Fistula of vagina to small intestine
198380007,N90.4,Leukoplakia of vulva
285751000,S25.301,Unspecified injury of right innominate or subclavian vein
285808008,S31.600,"Unspecified open wound of abdominal wall, right upper quadrant with penetration into peritoneal cavity"
285895001,W27.4,Contact with kitchen utensil
301126002,R01,Cardiac murmurs and other cardiac sounds
254969001,C72.2,Malignant neoplasm of olfactory nerve
255052006,C26,Malignant neoplasm of other and ill-defined digestive organs
255056009,C76.0,"Malignant neoplasm of head, face and neck"
300004007,Z13.820,Encounter for screening for osteoporosis
255166003,D14.4,"Benign neoplasm of respiratory system, unspecified"
201724008,E09.61,Drug or chemical induced diabetes mellitus with diabetic arthropathy
201766009,M05.01,"Felty's syndrome, shoulder"
201941004,M12.51,"Traumatic arthropathy, shoulder"
201952005,M12.56,"Traumatic arthropathy, knee"
201974004,T75.81,Effects of abnormal gravitation [G] forces
302289002,R27,Other lack of coordination
300648001,Y93.55,"Activity, bike riding"
254266000,Q91.2,"Trisomy 18, translocation"
254272000,Q92.7,Triploidy and polyploidy
254274004,Q93.8,Other deletions from the autosomes
254275003,Q95,"Balanced rearrangements and structural markers, not elsewhere classified"
254282004,Q97.1,Female with more than three X chromosomes
254286001,Q98.7,Male with sex chromosome mosaicism
202163005,M24.074,Loose body in right toe joint(s)
202182001,M24.33,"Pathological dislocation of wrist, not elsewhere classified"
300859007,N84,Polyp of female genital tract
287007001,M05.04,"Felty's syndrome, hand"
287039008,M66.15,"Rupture of synovium, hip"
287045000,M79.602,Pain in left arm
287046004,M79.601,Pain in right arm
287048003,M79.604,Pain in right leg
287057009,I49.1,Atrial premature depolarization
287070000,M80.07,"Age-related osteoporosis with current pathological fracture, ankle and foot"
287073003,S42.109P,"Fracture of unspecified part of scapula, unspecified shoulder, subsequent encounter for fracture with malunion"
287074009,S52.021Q,"Displaced fracture of olecranon process without intraarticular extension of right ulna, subsequent encounter for open fracture type I or II with malunion"
287075005,S62.112P,"Displaced fracture of triquetrum [cuneiform] bone, left wrist, subsequent encounter for fracture with malunion"
287077002,S82.123R,"Displaced fracture of lateral condyle of unspecified tibia, subsequent encounter for open fracture type IIIA, IIIB, or IIIC with malunion"
287078007,S92.811P,"Other fracture of right foot, subsequent encounter for fracture with malunion"
202307002,M24.62,"Ankylosis, elbow"
254601002,C22.4,Other sarcomas of liver
254677004,L72.1,Pilar and trichodermal cyst
202415003,M25.073,"Hemarthrosis, unspecified ankle"
202436001,M12.221,"Villonodular synovitis (pigmented), right elbow"
202482009,M25.532,Pain in left wrist
301412001,R10.826,Epigastric rebound abdominal tenderness
301414000,R10.822,Left upper quadrant rebound abdominal tenderness
202083009,M23.012,"Cystic meniscus, anterior horn of medial meniscus, left knee"
202138005,M94.8X7,"Other specified disorders of cartilage, ankle and foot"
202160008,M24.05,Loose body in hip
202192009,M24.373,"Pathological dislocation of unspecified ankle, not elsewhere classified"
202230005,M24.43,"Recurrent dislocation, wrist"
202252001,M24.479,"Recurrent dislocation, unspecified toe(s)"
254749001,M72,Fibroblastic disorders
202381003,M25.46,"Effusion, knee"
201663006,M1A.011,"Idiopathic chronic gout, right shoulder"
201669005,M1A.4721,"Other secondary chronic gout, left ankle and foot, with tophus (tophi)"
201775006,M05.05,"Felty's syndrome, hip"
201777003,M05.06,"Felty's syndrome, knee"
202480001,M25.522,Pain in left elbow
255062004,D37.09,Neoplasm of uncertain behavior of other specified sites of the oral cavity
255084004,C44.520,Squamous cell carcinoma of anal skin
302940000,M65.0,Abscess of tendon sheath
303063000,O15.2,Eclampsia complicating the puerperium
201769002,M05.02,"Felty's syndrome, elbow"
201771002,M05.03,"Felty's syndrome, wrist"
201796004,M08.2A,"Juvenile rheumatoid arthritis with systemic onset, other specified site"
201825001,M15.3,Secondary multiple arthritis
201826000,M15.4,Erosive (osteo)arthritis
201946009,M12.53,"Traumatic arthropathy, wrist"
285712005,S85.101,"Unspecified injury of unspecified tibial artery, right leg"
285738005,S95.001,Unspecified injury of dorsal artery of right foot
285758006,R41.842,Visuospatial deficit
202079009,S83.221,"Peripheral tear of medial meniscus, current injury, right knee"
301366005,R10,Abdominal and pelvic pain
201944007,M12.52,"Traumatic arthropathy, elbow"
201950002,M12.55,"Traumatic arthropathy, hip"
202046009,M36.1,Arthropathy in neoplastic disease
301032005,S32.511,Fracture of superior rim of right pubis
202094008,S83.261,"Peripheral tear of lateral meniscus, current injury, right knee"
202098006,M23.04,"Cystic meniscus, anterior horn of lateral meniscus"
202144009,M94.359,"Chondrolysis, unspecified hip"
202158006,M24.02,Loose body in elbow
202242000,M24.444,"Recurrent dislocation, right finger"
202250009,M24.471,"Recurrent dislocation, right ankle"
202310009,M24.63,"Ankylosis, wrist"
202317007,M24.66,"Ankylosis, knee"
202156005,M24.01,Loose body in shoulder
202159003,M24.03,Loose body in wrist
202162000,M24.071,Loose body in right ankle
202190001,M24.36,"Pathological dislocation of knee, not elsewhere classified"
286756000,R45.87,Impulsiveness
202246002,M22.0,Recurrent dislocation of patella
202248001,M22.1,Recurrent subluxation of patella
202318002,M24.673,"Ankylosis, unspecified ankle"
287008006,M05.07,"Felty's syndrome, ankle and foot"
287025008,M06.27,"Rheumatoid bursitis, ankle and foot"
287037005,M66.13,"Rupture of synovium, wrist"
287047008,M79.662,Pain in left lower leg
287062005,M92.501,"Unspecified juvenile osteochondrosis, right leg"
287064006,M84.411,"Pathological fracture, right shoulder"
202379000,M25.45,"Effusion, hip"
202383000,M25.471,"Effusion, right ankle"
202438000,M12.23,"Villonodular synovitis (pigmented), wrist"
286967008,K35.32,"Acute appendicitis with perforation, localized peritonitis, and gangrene, without abscess"
202373004,M25.42,"Effusion, elbow"
287017006,M65.11,"Other infective (teno)synovitis, shoulder"
287023001,M71.19,"Other infective bursitis, multiple sites"
287035002,M66.11,"Rupture of synovium, shoulder"
287038000,M66.14,"Rupture of synovium, hand and fingers"
287041009,M66.17,"Rupture of synovium, ankle, foot and toes"
287067004,M84.441,"Pathological fracture, right hand"
207036003,D47.Z2,Castleman disease
288244006,S42.214P,"Unspecified nondisplaced fracture of surgical neck of right humerus, subsequent encounter for fracture with malunion"
288250001,O16,Unspecified maternal hypertension
302873008,D69.42,Congenital and hereditary thrombocytopenia purpura
302933001,S83.271,"Complex tear of lateral meniscus, current injury, right knee"
302977008,V85.3,Unspecified occupant of special construction vehicle injured in traffic accident
22841008,Q73.1,"Phocomelia, unspecified limb(s)"
22886006,E71.313,Glutaric aciduria type II
303070000,Q25.72,Congenital pulmonary arteriovenous malformation
303081002,M48.062,"Spinal stenosis, lumbar region with neurogenic claudication"
233850007,I33.0,Acute and subacute infective endocarditis
304253006,Z66,Do not resuscitate
234009005,S35.01,Minor laceration of abdominal aorta
234119001,Q25.8,Other congenital malformations of other great arteries
234141001,Q27.39,"Arteriovenous malformation, other site"
25762009,R48.3,Visual agnosia
233846000,I23.2,Ventricular septal defect as current complication following acute myocardial infarction
233933006,T86.21,Heart transplant rejection
233947005,I27.24,Chronic thromboembolic pulmonary hypertension
286564009,S21.021,Laceration with foreign body of right breast
233692000,J82.81,Chronic eosinophilic pneumonia
233710001,J68.1,"Pulmonary edema due to chemicals, gases, fumes and vapors"
234171009,I95.2,Hypotension due to drugs
302809008,B95.0,"Streptococcus, group A, as the cause of diseases classified elsewhere"
302888003,H33.322,"Round hole, left eye"
302954008,Q50.4,Embryonic cyst of fallopian tube
302965003,S11.11,Laceration without foreign body of thyroid gland
286647002,R45.81,Low self-esteem
234392002,D56.5,Hemoglobin E-beta thalassemia
234422006,E80.21,Acute intermittent (hepatic) porphyria
234441009,Z14.02,Symptomatic hemophilia A carrier
234437005,D76.1,Hemophagocytic lymphohistiocytosis
234520000,T86.02,Bone marrow transplant failure
233815004,P29.30,Pulmonary hypertension of newborn
233816003,I97.19,Other postprocedural cardiac functional disturbances
288252009,O98,"Maternal infectious and parasitic diseases classifiable elsewhere but complicating pregnancy, childbirth and the puerperium"
233934000,T86.22,Heart transplant failure
234034005,T75.21,Pneumatic hammer syndrome
234058009,O22.1,Genital varices in pregnancy
234142008,Q28.2,Arteriovenous malformation of cerebral vessels
234949000,K00.6,Disturbances in tooth eruption
287036001,M66.12,"Rupture of synovium, elbow"
287055001,M86.65,"Other chronic osteomyelitis, thigh"
287165005,T39.1X1,"Poisoning by 4-Aminophenol derivatives, accidental (unintentional)"
235110008,K09.0,Developmental odontogenic cysts
234645009,D84.821,Immunodeficiency due to drugs
302952007,Q43.6,Congenital fistula of rectum and anus
302964004,S03.0,Dislocation of jaw
235104008,K01.1,Impacted teeth
305500009,Z76.81,Expectant parent(s) prebirth pediatrician visit
233823002,I25.6,Silent myocardial ischemia
233873004,I42.2,Other hypertrophic cardiomyopathy
233972005,I74.01,Saddle embolus of abdominal aorta
234084003,S35.11,Minor laceration of inferior vena cava
234184000,T82.03,Leakage of heart valve prosthesis
234189005,T82.02,Displacement of heart valve prosthesis
289195008,R47.81,Slurred speech
234467004,D68.6,Other thrombophilia
288301009,W88.0,Exposure to X-rays
289205009,O41.129,"Chorioamnionitis, unspecified trimester"
236665004,N39.492,Postural (urinary) incontinence
236723002,T83.111,Breakdown (mechanical) of implanted urinary sphincter
236734004,T83.420,Displacement of implanted penile prosthesis
236379002,N11.1,Chronic obstructive pyelonephritis
236547007,M83.4,Aluminum bone disease
236563004,T85.621,Displacement of intraperitoneal dialysis catheter
23687008,I20.1,Angina pectoris with documented spasm
304068004,Q36.0,"Cleft lip, bilateral"
289725009,O62.4,"Hypertonic, incoordinate, and prolonged uterine contractions"
237097008,A56.02,Chlamydial vulvovaginitis
236583003,T86.12,Kidney transplant failure
289903006,Z78.0,Asymptomatic menopausal state
236570004,T86.11,Kidney transplant rejection
236731007,T83.410,Breakdown (mechanical) of implanted penile prosthesis
289186000,R49,Voice and resonance disorders
237253003,O36.70,"Maternal care for viable fetus in abdominal pregnancy, unspecified trimester"
237272003,O46.012,"Antepartum hemorrhage with afibrinogenemia, second trimester"
289530006,N93.1,Pre-pubertal vaginal bleeding
237538007,E06.2,Chronic thyroiditis with transient thyrotoxicosis
237562002,E01,Iodine-deficiency related thyroid disorders and allied conditions
237566004,E00.0,"Congenital iodine-deficiency syndrome, neurological type"
125591009,T17.228,Food in pharynx causing other injury
125606003,S12.8,Fracture of other parts of neck
125608002,S32.008,Other fracture of unspecified lumbar vertebra
125620005,S63.104,Unspecified dislocation of right thumb
125628003,S36.400,Unspecified injury of duodenum
125631002,S36.500,Unspecified injury of ascending [right] colon
125660006,S81.001,"Unspecified open wound, right knee"
125662003,S91.001,"Unspecified open wound, right ankle"
125872003,S32.10,Unspecified fracture of sacrum
237145004,Z31.43,Encounter for genetic testing of female for procreative management
237249000,O01.0,Classical hydatidiform mole
237296008,O43.2,Morbidly adherent placenta
237300009,O36.191,"Maternal care for other isoimmunization, first trimester"
237444008,N61.2,Granulomatous mastitis
237515009,E03.1,Congenital hypothyroidism without goiter
237539004,E06.4,Drug-induced thyroiditis
237558008,E03.4,Atrophy of thyroid (acquired)
237565000,E00.2,"Congenital iodine-deficiency syndrome, mixed type"
237567008,E02,Subclinical iodine-deficiency hypothyroidism
127068004,D76.3,Other histiocytosis syndromes
12713001,L03,Cellulitis and acute lymphangitis
126764002,Q43,Other congenital malformations of intestine
126941005,P10.0,Subdural hemorrhage due to birth injury
264443002,H25.23,"Age-related cataract, morgagnian type, bilateral"
127016006,C75.8,"Malignant neoplasm with pluriglandular involvement, unspecified"
127278005,S69.80,"Other specified injuries of unspecified wrist, hand and finger(s)"
127035006,D61,Other aplastic anemias and other bone marrow failure syndromes
127014009,E11.52,Type 2 diabetes mellitus with diabetic peripheral angiopathy with gangrene
264633009,H35.36,Drusen (degenerative) of macula
127275008,T27,Burn and corrosion of respiratory tract
127299008,S06.891,Other specified intracranial injury with loss of consciousness of 30 minutes or less
26590002,Q10.1,Congenital ectropion
26660001,I77.81,Aortic ectasia
26649005,L97.805,Non-pressure chronic ulcer of other part of unspecified lower leg with muscle involvement without evidence of necrosis
127281000,S02.113,Unspecified occipital condyle fracture
26690008,Z3A.08,8 weeks gestation of pregnancy
278534004,N99.510,Cystostomy hemorrhage
410478005,A51.43,Secondary syphilitic oculopathy
127313006,S36.13,Injury of bile duct
127388009,D89.2,"Hypergammaglobulinemia, unspecified"
410797009,M08.3,Juvenile rheumatoid polyarthritis (seronegative)
279001004,R07,Pain in throat and chest
127277000,S30.814,Abrasion of vagina and vulva
127287001,S72.141,Displaced intertrochanteric fracture of right femur
127292004,S83.511,Sprain of anterior cruciate ligament of right knee
127293009,S83.521,Sprain of posterior cruciate ligament of right knee
127300000,S06.893,Other specified intracranial injury with loss of consciousness of 1 hour to 5 hours 59 minutes
278537006,S82.301,Unspecified fracture of lower end of right tibia
278509004,G11.0,Congenital nonprogressive ataxia
278516003,J18.1,"Lobar pneumonia, unspecified organism"
278532000,Q72.2,Congenital absence of both lower leg and foot
127225006,C93.1,Chronic myelomonocytic leukemia
127286005,S42.201,Unspecified fracture of upper end of right humerus
12776000,T18.4,Foreign body in colon
128125000,S27.401,"Unspecified injury of bronchus, unilateral"
128188000,G80,Cerebral palsy
128196005,M54.16,"Radiculopathy, lumbar region"
128271002,P02.70,Newborn affected by fetal inflammatory response syndrome
128282005,L03.04,Acute lymphangitis of toe
263013004,S33.2,Dislocation of sacroiliac and sacrococcygeal joint
263021005,S43.014,Anterior dislocation of right humerus
263022003,S43.016,Anterior dislocation of unspecified humerus
263040004,S13.100,Subluxation of unspecified cervical vertebrae
263042007,S13.120,Subluxation of C1/C2 cervical vertebrae
263043002,S23.100,Subluxation of unspecified thoracic vertebra
263045009,M99.14,Subluxation complex (vertebral) of sacral region
263048006,S43.201,Unspecified subluxation of right sternoclavicular joint
263051004,S43.001,Unspecified subluxation of right shoulder joint
263056009,M99.15,Subluxation complex (vertebral) of pelvic region
263060007,S93.01,Subluxation of right ankle joint
263129009,S63.610,Unspecified sprain of right index finger
263164000,S02.400,"Malar fracture, unspecified side"
263171005,S02.2,Fracture of nasal bones
263199001,S52.501,Unspecified fracture of the lower end of right radius
263204007,S52.201,Unspecified fracture of shaft of right ulna
263235001,S72.451,Displaced supracondylar fracture without intracondylar extension of lower end of right femur
263237009,S82.154P,"Nondisplaced fracture of right tibial tuberosity, subsequent encounter for closed fracture with malunion"
263238004,S82.151J,"Displaced fracture of right tibial tuberosity, subsequent encounter for open fracture type IIIA, IIIB, or IIIC with delayed healing"
263242001,S89.311,Salter-Harris Type I physeal fracture of lower end of right fibula
263244000,S82.841,Displaced bimalleolar fracture of right lower leg
263245004,S92.201,Fracture of unspecified tarsal bone(s) of right foot
263248002,S92.251,Displaced fracture of navicular [scaphoid] of right foot
128136007,M01.X6,Direct infection of knee in infectious and parasitic diseases classified elsewhere
128187005,G44.1,"Vascular headache, not elsewhere classified"
128189008,G58,Other mononeuropathies
398100001,G60.0,Hereditary motor and sensory neuropathy
128200000,M89.0,Algoneurodystrophy
128321003,K55,Vascular disorders of intestine
128331005,H47.3,Other disorders of optic disc
128352002,Q13.4,Other congenital corneal malformations
262879002,S36.63,Laceration of rectum
262893009,S37.031,"Laceration of right kidney, unspecified degree"
262926008,S37.431,"Laceration of ovary, unilateral"
262937009,S15.8,Injury of other specified blood vessels at neck level
398565003,A48.5,Other specified botulism
263015006,M43.4,Other recurrent atlantoaxial dislocation
263023008,S53.004,Unspecified dislocation of right radial head
263027009,S63.011,Subluxation of distal radioulnar joint of right wrist
263044008,S33.100,Subluxation of unspecified lumbar vertebra
263047001,S43.301,Subluxation of unspecified parts of right shoulder girdle
263049003,S43.111,Subluxation of right acromioclavicular joint
263052006,S53.101,Unspecified subluxation of right ulnohumeral joint
263059002,S83.001,Unspecified subluxation of right patella
263062004,S93.101,Unspecified subluxation of right toe(s)
31601007,O00.81,Other ectopic pregnancy with intrauterine pregnancy
31615009,P71.4,Transitory neonatal hypoparathyroidism
412768003,Z68.2,"Body mass index [BMI] 20-29, adult"
31892009,J94.2,Hemothorax
32113001,Q70.2,Fused toes
263168002,S02.83,Fracture of medial orbital wall
263205008,S52.601,Unspecified fracture of lower end of right ulna
263209002,S62.316,"Displaced fracture of base of fifth metacarpal bone, right hand"
263210007,S62.336,"Displaced fracture of neck of fifth metacarpal bone, right hand"
263226008,S72.011,Unspecified intracapsular fracture of right femur
263229001,S72.21,Displaced subtrochanteric fracture of right femur
263232003,S72.401,Unspecified fracture of lower end of right femur
263236000,S72.411,Displaced unspecified condyle fracture of lower end of right femur
263246003,S92.101,Unspecified fracture of right talus
31712002,K74.3,Primary biliary cirrhosis
31848007,M34.1,CR(E)ST syndrome
31550006,H44.7,"Retained (old) intraocular foreign body, nonmagnetic"
32232003,Q05.5,Cervical spina bifida without hydrocephalus
3199001,S43.401,Unspecified sprain of right shoulder joint
31568009,A32.1,Listerial meningitis and meningoencephalitis
263009006,S43.204,Unspecified dislocation of right sternoclavicular joint
263053001,S63.001,Unspecified subluxation of right wrist and hand
263055008,S63.101,Unspecified subluxation of right thumb
263070009,S12.130,Unspecified traumatic displaced spondylolisthesis of second cervical vertebra
263151001,S02.40CA,"Maxillary fracture, right side, initial encounter for closed fracture"
263155005,S02.4,"Fracture of malar, maxillary and zygoma bones"
263157002,S02.42,Fracture of alveolus of maxilla
263169005,S02.84,Fracture of lateral orbital wall
263193000,S42.411,Displaced simple supracondylar fracture without intercondylar fracture of right humerus
263195007,S52.101,Unspecified fracture of upper end of right radius
263196008,S52.121,Displaced fracture of head of right radius
263198009,S52.301,Unspecified fracture of shaft of right radius
263203001,S52.001,Unspecified fracture of upper end of right ulna
263220002,S32.601,Unspecified fracture of right ischium
263222005,S32.810,Multiple fractures of pelvis with stable disruption of pelvic ring
32097002,K55.30,"Necrotizing enterocolitis, unspecified"
263227004,S72.031,Displaced midcervical fracture of right femur
263228009,S72.041,Displaced fracture of base of neck of right femur
263240009,S82.871,Displaced pilon fracture of right tibia
263249005,S92.211,Displaced fracture of cuboid bone of right foot
413298002,Z73.6,Limitation of activities due to disability
262877000,S36.62,Contusion of rectum
31928004,L02.81,Cutaneous abscess of other sites
425869007,C92.41,"Acute promyelocytic leukemia, in remission"
32096006,N94.5,Secondary dysmenorrhea
3214003,B44.0,Invasive pulmonary aspergillosis
31975004,S62.001,Unspecified fracture of navicular [scaphoid] bone of right wrist
