snomed_code,icd10_code,icd10_description
39763004,O99.81,"Abnormal glucose complicating pregnancy, childbirth and the puerperium"
77854008,O61.0,Failed medical induction of labor
354223006,M92.59,Other juvenile osteochondrosis of tibia and fibula
23060008,M20.03,Swan-neck deformity
313178001,Z3A.24,24 weeks gestation of pregnancy
57907009,Z3A.36,36 weeks gestation of pregnancy
52837007,Q72.4,Longitudinal reduction defect of femur
3415004,R23.0,Cyanosis
129588001,R62.7,Adult failure to thrive
37449000,S52.281N,"Bent bone of right ulna, subsequent encounter for open fracture type IIIA, IIIB, or IIIC with nonunion"
207771005,S02.650B,"Fracture of angle of mandible, unspecified side, initial encounter for open fracture"
28576007,S72.8X9N,"Other fracture of unspecified femur, subsequent encounter for open fracture type IIIA, IIIB, or IIIC with nonunion"
67843002,S45.001,"Unspecified injury of axillary artery, right side"
33603003,T81.502,Unspecified complication of foreign body accidentally left in body following kidney dialysis
218190002,X39.08,Exposure to other natural radiation
216483006,T39.4X1,"Poisoning by antirheumatics, not elsewhere classified, accidental (unintentional)"
216993005,Y64.0,"Contaminated medical or biological substance, transfused or infused"
217779001,T17.210,Gastric contents in pharynx causing asphyxiation
292275009,T43.1X5,Adverse effect of monoamine-oxidase-inhibitor antidepressants
111760006,T45.2X1,"Poisoning by vitamins, accidental (unintentional)"
216941008,Y62.6,"Failure of sterile precautions during aspiration, puncture and other catheterization"
216964005,Y63.5,Inappropriate temperature in local application and packing
32144005,T79.5,Traumatic anuria
216651006,T51.3X1,"Toxic effect of fusel oil, accidental (unintentional)"
81159000,A05.3,Foodborne Vibrio parahaemolyticus intoxication
17653001,A18.0,Tuberculosis of bones and joints
50215002,A36.2,Laryngeal diphtheria
43489008,A98.0,Crimean-Congo hemorrhagic fever
40610006,A92,Other mosquito-borne viral fevers
31541009,D86,Sarcoidosis
109832008,C10.8,Malignant neoplasm of overlapping sites of oropharynx
93861003,C11.2,Malignant neoplasm of lateral wall of nasopharynx
93891008,C38.3,"Malignant neoplasm of mediastinum, part unspecified"
371991005,C05.0,Malignant neoplasm of hard palate
93980002,C19,Malignant neoplasm of rectosigmoid junction
190640006,E55.0,"Rickets, active"
267434003,E78.2,Mixed hyperlipidemia
45744005,E83,Disorders of mineral metabolism
60853003,E83.4,Disorders of magnesium metabolism
21420006,P74.41,Alkalosis of newborn
270486005,E65,Localized adiposity
31216003,F73,Profound intellectual disabilities
33382000,H44.01,Panophthalmitis (acute)
75315001,H44.133,"Sympathetic uveitis, bilateral"
89188001,H30.142,"Acute posterior multifocal placoid pigment epitheliopathy, left eye"
69134001,H35.43,Paving stone degeneration of retina
5318001,H25.04,Posterior subcapsular polar age-related cataract
70461003,H20.2,Lens-induced iridocyclitis
193821003,H18.32,Folds in Descemet's membrane
84627005,H04.413,Chronic dacryocystitis of bilateral lacrimal passages
25470000,H04.323,Acute dacryocystitis of bilateral lacrimal passages
26479009,H04.423,Chronic lacrimal canaliculitis of bilateral lacrimal passages
87819007,H44.2D,Degenerative myopia with foveoschisis
40527005,J84.03,Idiopathic pulmonary hemosiderosis
82212003,K03.2,Erosion of teeth
111591002,J35.2,Hypertrophy of adenoids
12351004,M26.31,Crowding of fully erupted teeth
110318003,M26.54,Insufficient anterior guidance
198661003,O03.81,Shock following complete or unspecified spontaneous abortion
22049009,N60.4,Mammary duct ectasia
72860003,O41.8X1,"Other specified disorders of amniotic fluid and membranes, first trimester"
56272000,O87.1,Deep phlebothrombosis in the puerperium
77403000,M60.2,"Foreign body granuloma of soft tissue, not elsewhere classified"
203291003,M89.66,"Osteopathy after poliomyelitis, lower leg"
43234007,M20.022,Boutonniere deformity of left finger(s)
71781005,R29.890,Loss of height
267023007,R63.2,Polyphagia
25899002,S82.844D,"Nondisplaced bimalleolar fracture of right lower leg, subsequent encounter for closed fracture with routine healing"
7551007,S62.252A,"Displaced fracture of neck of first metacarpal bone, left hand, initial encounter for closed fracture"
26442006,S72.301A,"Unspecified fracture of shaft of right femur, initial encounter for closed fracture"
5166001,S15.201,Unspecified injury of right external jugular vein
81642009,S14.101S,"Unspecified injury at C1 level of cervical spinal cord, sequela"
242146008,V17.0,Pedal cycle driver injured in collision with fixed or stationary object in nontraffic accident
269662007,V80.61,Animal-rider injured in collision with railway train or railway vehicle
90806009,T81.60,Unspecified acute reaction to foreign substance accidentally left during a procedure
288297000,X02.3,Fall from burning building or structure in controlled fire
225826001,O9A.4,"Sexual abuse complicating pregnancy, childbirth and the puerperium"
216530001,T42.4X1,"Poisoning by benzodiazepines, accidental (unintentional)"
216550002,T40.901,"Poisoning by unspecified psychodysleptics [hallucinogens], accidental (unintentional)"
218251009,X02.1XXS,"Exposure to smoke in controlled fire in building or structure, sequela"
219207005,X96.0XXD,"Assault by antipersonnel bomb, subsequent encounter"
398530003,A48.52,Wound botulism
111910009,A06,Amebiasis
409498004,A22,Anthrax
10698009,B02.32,Zoster iridocyclitis
75116005,A70,Chlamydia psittaci infections
417093003,A92.3,West Nile virus infection
372107001,C41.3,"Malignant neoplasm of ribs, sternum and clavicle"
93826009,C18.3,Malignant neoplasm of hepatic flexure
93672006,C04.0,Malignant neoplasm of anterior floor of mouth
255047001,D3A,Benign neuroendocrine tumors
109914007,D42,Neoplasm of uncertain behavior of meninges
72366004,F50,Eating disorders
116020001,E71,Disorders of branched-chain amino-acid metabolism and fatty-acid metabolism
26025008,F20.5,Residual schizophrenia
415238003,G47.52,REM sleep behavior disorder
25913001,H21.26,Iris atrophy (essential) (progressive)
24121004,F51.05,Insomnia due to other mental disorder
75614007,H44.113,"Panuveitis, bilateral"
56787009,H30.03,"Focal chorioretinal inflammation, peripheral"
191813001,F10.21,"Alcohol dependence, in remission"
87807004,H20.05,Hypopyon
48615000,H04.611,Lacrimal fistula right lacrimal passage
85777005,H04.30,Unspecified dacryocystitis
11772001,H04.572,Stenosis of left lacrimal sac
11543004,H80,Otosclerosis
109516004,M26.05,Macrogenia
9491003,K14.4,Atrophy of tongue papillae
71315007,N94.1,Dyspareunia
82639001,N94.3,Premenstrual tension syndrome
123756000,N95.1,Menopausal and female climacteric states
417044008,O01,Hydatidiform mole
64229006,O71,Other obstetric trauma
52636001,L57.1,Actinic reticuloid
53417006,M24.19,"Other articular cartilage disorders, other specified site"
276658003,P07.2,Extreme immaturity of newborn
32984002,P61.1,Polycythemia neonatorum
161833006,R63.5,Abnormal weight gain
48165008,R82.1,Myoglobinuria
48167000,R41.3,Other amnesia
55444004,P61.5,Transient neonatal neutropenia
69425000,S02.601B,"Fracture of unspecified part of body of right mandible, initial encounter for open fracture"
15385006,S82.54XG,"Nondisplaced fracture of medial malleolus of right tibia, subsequent encounter for closed fracture with delayed healing"
40047007,S12.530,Unspecified traumatic displaced spondylolisthesis of sixth cervical vertebra
111640008,S52.381D,"Bent bone of right radius, subsequent encounter for closed fracture with routine healing"
10815006,T22.341,Burn of third degree of right axilla
57346004,T51.3X2,"Toxic effect of fusel oil, intentional self-harm"
7680008,S44.40,"Injury of musculocutaneous nerve, unspecified arm"
216545008,T43.021,"Poisoning by tetracyclic antidepressants, accidental (unintentional)"
217665000,T63.301,"Toxic effect of unspecified spider venom, accidental (unintentional)"
218191003,W90.0,Exposure to radiofrequency
74264003,T40.0X2,"Poisoning by opium, intentional self-harm"
217964003,W31.1XXD,"Contact with metalworking machines, subsequent encounter"
293032001,T37.0X5,Adverse effect of sulfonamides
276853009,T36.1X2,"Poisoning by cephalosporins and other beta-lactam antibiotics, intentional self-harm"
219335006,Y22,"Handgun discharge, undetermined intent"
52684005,Y09,Assault by unspecified means
191641004,F31.64,"Bipolar disorder, current episode mixed, severe, with psychotic features"
191639000,F31.62,"Bipolar disorder, current episode mixed, moderate"
191638008,F31.61,"Bipolar disorder, current episode mixed, mild"
191629006,F31.31,"Bipolar disorder, current episode depressed, mild"
191627008,F31.3,"Bipolar disorder, current episode depressed, mild or moderate severity"
191623007,F31.2,"Bipolar disorder, current episode manic severe with psychotic features"
191588009,F30.4,Manic episode in full remission
194281003,H66.0,Acute suppurative otitis media
188631008,C84.12,"Sezary disease, intrathoracic lymph nodes"
188634000,C84.15,"Sezary disease, lymph nodes of inguinal region and lower limb"
188632001,C84.13,"Sezary disease, intra-abdominal lymph nodes"
188635004,C84.16,"Sezary disease, intrapelvic lymph nodes"
191584006,F30.12,"Manic episode without psychotic symptoms, moderate"
191583000,F30.11,"Manic episode without psychotic symptoms, mild"
191476005,F10.232,Alcohol dependence with withdrawal with perceptual disturbance
194131002,H51.11,Convergence insufficiency
188592008,C81.37,"Lymphocyte depleted Hodgkin lymphoma, spleen"
188591001,C81.36,"Lymphocyte depleted Hodgkin lymphoma, intrapelvic lymph nodes"
188587006,C81.33,"Lymphocyte depleted Hodgkin lymphoma, intra-abdominal lymph nodes"
188516007,C83.77,"Burkitt lymphoma, spleen"
193589009,H25.1,Age-related nuclear cataract
196019004,J68.0,"Bronchitis and pneumonitis due to chemicals, gases, fumes and vapors"
193341001,H33.31,Horseshoe tear of retina without detachment
195410000,I80.1,Phlebitis and thrombophlebitis of femoral vein
399100005,E23.3,"Hypothalamic dysfunction, not elsewhere classified"
371161001,S02.91XB,"Unspecified fracture of skull, initial encounter for open fracture"
373433005,H18.81,Anesthesia and hypoesthesia of cornea
397996002,Y38.2X1,"Terrorism involving other explosions and fragments, public safety official injured"
398019008,O70,Perineal laceration during delivery
371778002,T74.11,"Adult physical abuse, confirmed"
398254007,O14,Pre-eclampsia
371775004,T74.32,"Child psychological abuse, confirmed"
371708003,T75.4,Electrocution
372001002,C06,Malignant neoplasm of other and unspecified parts of mouth
232340005,J34.8,Other specified disorders of nose and nasal sinuses
225559007,L89.0,Pressure ulcer of elbow
225558004,L89.1,Pressure ulcer of back
397007003,Q82.2,Congenital cutaneous mastocytosis
402355000,D89.810,Acute graft-versus-host disease
219401009,Y36.240,"War operations involving explosion due to accidental detonation and discharge of own munitions or munitions launch device, military personnel"
219393002,Y36.000,"War operations involving explosion of unspecified marine weapon, military personnel"
219387005,Y36.220,"War operations involving explosion of guided missile, military personnel"
219373005,Y37.420,"Military operations involving firearms pellets, military personnel"
219369007,Y36.310,"War operations involving gasoline bomb, military personnel"
162213003,R45.83,"Excessive crying of child, adolescent or adult"
219343001,Y28.1,"Contact with knife, undetermined intent"
219333004,Y21.2,"Drowning and submersion while in swimming pool, undetermined intent"
219330001,T71.124,"Asphyxiation due to plastic bag, undetermined"
219209008,X96.2XXA,"Assault by letter bomb, initial encounter"
219208000,X96.1XXD,"Assault by gasoline bomb, subsequent encounter"
219205002,Y37.430,"Military operations involving other firearms discharge, military personnel"
219197006,X92.3,Assault by drowning and submersion in natural water
219191007,T71.163,"Asphyxiation due to hanging, assault"
217815007,T71.111,"Asphyxiation due to smothering under pillow, accidental"
216603003,T44.6X1,"Poisoning by alpha-adrenoreceptor antagonists, accidental (unintentional)"
217724009,X37.2,Blizzard (snow)(ice)
217736003,X37.43,Tidal wave due to landslide
217625004,W94.21,Exposure to reduction in atmospheric pressure while surfacing from deep-water diving
216479006,T39.2X1,"Poisoning by pyrazolone derivatives, accidental (unintentional)"
216309006,V98.1,"Accident to, on or involving land-yacht"
219123000,T57.0X2,"Toxic effect of arsenic and its compounds, intentional self-harm"
218868004,T44.2X5,Adverse effect of ganglionic blocking drugs
217574009,X08.00,Exposure to bed fire due to unspecified burning material
217534003,X04,Exposure to ignition of highly flammable material
217527000,X08.01,Exposure to bed fire due to burning cigarette
217150002,V00.841,Fall from standing electric scooter
218608004,T39.2X5,Adverse effect of pyrazolone derivatives
217006001,Y65.1,Wrong fluid used in infusion
218246003,V00.848S,"Other accident with standing micro-mobility pedestrian conveyance, sequela"
216957008,Y63.1,Incorrect dilution of fluid used during infusion
216940009,Y62.4,Failure of sterile precautions during endoscopic examination
216936000,Y62.3,Failure of sterile precautions during injection or immunization
216928009,Y62.1,Failure of sterile precautions during infusion or transfusion
216926008,Y62,Failure of sterile precautions during surgical and medical care
216904007,T81.502,Unspecified complication of foreign body accidentally left in body following kidney dialysis
218107005,W40.1XXA,"Explosion of explosive gases, initial encounter"
216859005,T59.3X1,"Toxic effect of lacrimogenic gas, accidental (unintentional)"
218035007,W26.0XXA,"Contact with knife, initial encounter"
171259000,Z28.83,Immunization not carried out due to unavailability of vaccine
186973005,A66.8,Latent yaws
202264009,M24.50,"Contracture, unspecified joint"
186628001,B19.21,Unspecified viral hepatitis C with hepatic coma
186626002,B16.1,Acute hepatitis B with delta-agent without hepatic coma
186639003,B18.1,Chronic viral hepatitis B without delta-agent
186624004,B16.0,Acute hepatitis B with delta-agent with hepatic coma
186747009,B34.2,"Coronavirus infection, unspecified"
201921009,M12.11,"Kaschin-Beck disease, shoulder"
198647008,O03.32,Renal failure following incomplete spontaneous abortion
194781004,I13.2,"Hypertensive heart and chronic kidney disease with heart failure and with stage 5 chronic kidney disease, or end stage renal disease"
194779001,I13.0,"Hypertensive heart and chronic kidney disease with heart failure and stage 1 through stage 4 chronic kidney disease, or unspecified chronic kidney disease"
42100005,A95.0,Sylvatic yellow fever
86406008,B20,Human immunodeficiency virus [HIV] disease
21061004,B60.00,"Babesiosis, unspecified"
59925007,B41,Paracoccidioidomycosis
94076001,C08.1,Malignant neoplasm of sublingual gland
93971002,C10.3,Malignant neoplasm of posterior wall of oropharynx
93831006,C13,Malignant neoplasm of hypopharynx
92446002,D14.2,Benign neoplasm of trachea
420270002,E10.1,Type 1 diabetes mellitus with ketoacidosis
92772005,D02.1,Carcinoma in situ of trachea
95136000,D38.4,Neoplasm of uncertain behavior of thymus
271737000,D64,Other anemias
76169001,E54,Ascorbic acid deficiency
190745006,E74.21,Galactosemia
110352000,G31.84,Mild cognitive impairment of uncertain or unknown etiology
21664006,G03.1,Chronic meningitis
25690000,G57.23,"Lesion of femoral nerve, bilateral lower limbs"
406446000,H31.1,Choroidal degeneration
5299007,H15.853,"Ring staphyloma, bilateral"
78031003,I06.1,Rheumatic aortic insufficiency
427567003,I75.01,Atheroembolism of upper extremity
31268005,I82.1,Thrombophlebitis migrans
1415005,I89.1,Lymphangitis
77949003,H93.3,Disorders of acoustic nerve
85232009,I50.1,"Left ventricular failure, unspecified"
232420002,J35.02,Chronic adenoiditis
69339004,J67.2,Bird fancier's lung
64917006,J12.2,Parainfluenza virus pneumonia
34615008,R36.1,Hematospermia
268002004,M66.8,Spontaneous rupture of other tendons
203292005,M89.67,"Osteopathy after poliomyelitis, ankle and foot"
271795006,R53,Malaise and fatigue
372070002,I96,"Gangrene, not elsewhere classified"
43029002,R29.3,Abnormal posture
59556008,S82.863H,"Displaced Maisonneuve's fracture of unspecified leg, subsequent encounter for open fracture type I or II with delayed healing"
225553008,T81.30,"Disruption of wound, unspecified"
302974001,V86.53,Driver of dune buggy injured in nontraffic accident
218130004,Y27.1,"Contact with hot tap water, undetermined intent"
293177002,T38.3X5,Adverse effect of insulin and oral hypoglycemic [antidiabetic] drugs
216471009,T39.091,"Poisoning by salicylates, accidental (unintentional)"
35688006,T88.8,"Other specified complications of surgical and medical care, not elsewhere classified"
215748004,V93.10,Other burn on board merchant vessel
216645001,T51.2X1,"Toxic effect of 2-Propanol, accidental (unintentional)"
243035000,Y38.0X1,"Terrorism involving explosion of marine weapons, public safety official injured"
293354007,T45.4X5,Adverse effect of iron and its compounds
38362002,A90,Dengue fever [classical dengue]
417192005,A83.3,St Louis encephalitis
28944009,B25,Cytomegaloviral disease
271425001,A75.3,Typhus fever due to Rickettsia tsutsugamushi
42386007,B45,Cryptococcosis
74942003,B67,Echinococcosis
109368005,C13.8,Malignant neoplasm of overlapping sites of hypopharynx
94103007,C09.1,Malignant neoplasm of tonsillar pillar (anterior) (posterior)
268637002,F52,Sexual dysfunction not due to a substance or known physiological condition
119250001,D80.1,Nonfamilial hypogammaglobulinemia
191618007,F31.1,"Bipolar disorder, current episode manic without psychotic features"
80711002,F60.81,Narcissistic personality disorder
52954000,F60.1,Schizoid personality disorder
58690002,G47.59,Other parasomnia
230496009,G47.24,"Circadian rhythm sleep disorder, free running type"
95709007,H21.29,Other iris atrophy
370504007,H40.83,Aqueous misdirection
41115008,H02.71,Chloasma of eyelid and periocular area
49774006,H05.259,"Intermittent exophthalmos, unspecified eye"
17467004,J34.3,Hypertrophy of nasal turbinates
26808007,J33.1,Polypoid sinus degeneration
49483002,J98.5,"Diseases of mediastinum, not elsewhere classified"
27075004,O98.3,"Other infections with a predominantly sexual mode of transmission complicating pregnancy, childbirth and the puerperium"
53443007,O63,Long labor
59349003,M21.33,Wrist drop (acquired)
69278003,Q13.1,Absence of iris
13499006,Q10.6,Other congenital malformations of lacrimal apparatus
58660009,M21.521,"Acquired clubhand, right hand"
75922002,Q16.3,Congenital malformation of ear ossicles
62067003,Q23.4,Hypoplastic left heart syndrome
387705004,P55,Hemolytic disease of newborn
207755005,S02.610A,"Fracture of condylar process of mandible, unspecified side, initial encounter for closed fracture"
269080004,S42.491A,"Other displaced fracture of lower end of right humerus, initial encounter for closed fracture"
36924003,S99.101A,"Unspecified physeal fracture of right metatarsal, initial encounter for closed fracture"
210790008,S25.401,Unspecified injury of right pulmonary blood vessels
17383000,T58.13,"Toxic effect of carbon monoxide from utility gas, assault"
49880009,S97.109S,"Crushing injury of unspecified toe(s), sequela"
31871009,T84.50,Infection and inflammatory reaction due to unspecified internal joint prosthesis
55566008,T36.1X1,"Poisoning by cephalosporins and other beta-lactam antibiotics, accidental (unintentional)"
218225007,X52,Prolonged stay in weightless environment
217744003,X35.XXXD,"Volcanic eruption, subsequent encounter"
417895009,T49.8X5,Adverse effect of other topical agents
429494008,D78.33,Postprocedural seroma of the spleen following a procedure on the spleen
216463005,T40.1X1,"Poisoning by heroin, accidental (unintentional)"
219336007,Y23.0,"Shotgun discharge, undetermined intent"
71057007,B96.2,Escherichia coli [E. coli ] as the cause of diseases classified elsewhere
6185008,B96.81,Helicobacter pylori [H. pylori] as the cause of diseases classified elsewhere
10491005,B01.0,Varicella meningitis
16814004,B95.3,Streptococcus pneumoniae as the cause of diseases classified elsewhere
266123003,A44,Bartonellosis
416925005,A83.2,Eastern equine encephalitis
371997009,C03.1,Malignant neoplasm of lower gum
372006007,C60.0,Malignant neoplasm of prepuce
93862005,C10.2,Malignant neoplasm of lateral wall of oropharynx
93495008,C81.02,"Nodular lymphocyte predominant Hodgkin lymphoma, intrathoracic lymph nodes"
12313004,E34.5,Androgen insensitivity syndrome
267433009,E78.1,Pure hyperglyceridemia
37465004,D72.822,Plasmacytosis
55341008,F60.4,Histrionic personality disorder
29740003,E41,Nutritional marasmus
414029004,D89,"Other disorders involving the immune mechanism, not elsewhere classified"
191736004,F42,Obsessive-compulsive disorder
44695005,R29.5,Transient paralysis
161129001,F81.8,Other developmental disorders of scholastic skills
31537005,G47.22,"Circadian rhythm sleep disorder, advanced sleep phase type"
230746009,G91.1,Obstructive hydrocephalus
85005007,F12.2,Cannabis dependence
4510004,G00.2,Streptococcal meningitis
73757007,H34,Retinal vascular occlusions
68241007,H40.3,Glaucoma secondary to eye trauma
74783009,H04.56,Stenosis of lacrimal punctum
1674008,H18.521,"Epithelial (juvenile) corneal dystrophy, right eye"
371436007,H05,Disorders of orbit
31021007,H05.81,Cyst of orbit
87486003,R47.01,Aphasia
46970008,J15.7,Pneumonia due to Mycoplasma pneumoniae
6288001,K03.6,Deposits [accretions] on teeth
26624006,K00.0,Anodontia
74400008,K36,Other appendicitis
270500004,O69.0,Labor and delivery complicated by prolapse of cord
33534005,Q68.3,Congenital bowing of femur
287066008,M84.439,"Pathological fracture, unspecified ulna and radius"
373585009,Q62.12,Congenital occlusion of ureterovesical orifice
70173007,Q93.4,Deletion of short arm of chromosome 5
71457002,R13.12,"Dysphagia, oropharyngeal phase"
7293009,P08.1,Other heavy for gestational age newborn
43337002,S02.670B,"Fracture of alveolus of mandible, unspecified side, initial encounter for open fracture"
66691008,S32.9XXB,"Fracture of unspecified parts of lumbosacral spine and pelvis, initial encounter for open fracture"
25529004,S52.502R,"Unspecified fracture of the lower end of left radius, subsequent encounter for open fracture type IIIA, IIIB, or IIIC with malunion"
46422008,S62.358A,"Nondisplaced fracture of shaft of other metacarpal bone, initial encounter for closed fracture"
263233008,S72.401P,"Unspecified fracture of lower end of right femur, subsequent encounter for closed fracture with malunion"
263025001,S63.031,Subluxation of midcarpal joint of right wrist
36523002,S85.161,"Unspecified injury of posterior tibial artery, right leg"
78523004,T66.XXXS,"Radiation sickness, unspecified, sequela"
49898008,T79.2,Traumatic secondary and recurrent hemorrhage and seroma
216588000,T44.1X1,"Poisoning by other parasympathomimetics [cholinergics], accidental (unintentional)"
216911006,T81.504,Unspecified complication of foreign body accidentally left in body following endoscopic examination
419912001,X50.1,Overexertion from prolonged static or awkward postures
242903006,Y04.1XXA,"Assault by human bite, initial encounter"
90765000,T59.4X2,"Toxic effect of chlorine gas, intentional self-harm"
217624000,W94.32,Exposure to high air pressure from rapid descent in water
218099004,W40,Explosion of other materials
71677004,T70.8,Other effects of air pressure and water pressure
219204003,X94.1XXD,"Assault by hunting rifle, subsequent encounter"
427795000,A23.1,Brucellosis due to Brucella abortus
88415009,A31,Infection due to other mycobacteria
13608004,B00.51,Herpesviral iridocyclitis
39111003,A75.0,Epidemic louse-borne typhus fever due to Rickettsia prowazekii
23502006,A69.2,Lyme disease
79974007,A28.1,Cat-scratch disease
8098009,A63,"Other predominantly sexually transmitted diseases, not elsewhere classified"
372119009,C25.0,Malignant neoplasm of head of pancreas
187192000,B58,Toxoplasmosis
94045007,C43.6,"Malignant melanoma of upper limb, including shoulder"
92443005,D10.1,Benign neoplasm of tongue
90560007,M1A.9,"Chronic gout, unspecified"
25501002,F40.1,Social phobias
13601005,F60.0,Paranoid personality disorder
76105009,F34.0,Cyclothymic disorder
192673008,D86.81,Sarcoid meningitis
271569006,G91.0,Communicating hydrocephalus
64309007,G50,Disorders of trigeminal nerve
373621006,G89.4,Chronic pain syndrome
78778007,H21.50,Unspecified adhesions of iris
111512005,H21.54,Posterior synechiae (iris)
57100005,H44.12,"Parasitic endophthalmitis, unspecified"
89114005,H20.03,Secondary infectious iridocyclitis
267660007,H15.03,Posterior scleritis
24363009,I00,Rheumatic fever without heart involvement
195012000,I39,Endocarditis and heart valve disorders in diseases classified elsewhere
195404000,I80.11,Phlebitis and thrombophlebitis of right femoral vein
359789008,M31.4,Aortic arch syndrome [Takayasu]
15033003,J36,Peritonsillar abscess
4654002,K03.7,Posteruptive color changes of dental hard tissues
90325002,O21.8,Other vomiting complicating pregnancy
287069001,M84.469,"Pathological fracture, unspecified tibia and fibula"
70070008,M43.6,Torticollis
239735004,M24.53,"Contracture, wrist"
54441004,S72.301,Unspecified fracture of shaft of right femur
204967008,Q62.3,Other obstructive defects of renal pelvis and ureter
433145001,P08.22,Prolonged gestation of newborn
414821002,P37.5,Neonatal candidiasis
73749009,P59.0,Neonatal jaundice associated with preterm delivery
66517001,S02.601A,"Fracture of unspecified part of body of right mandible, initial encounter for closed fracture"
91296001,S52.90XE,"Unspecified fracture of unspecified forearm, subsequent encounter for open fracture type I or II with routine healing"
73244003,S42.214A,"Unspecified nondisplaced fracture of surgical neck of right humerus, initial encounter for closed fracture"
