snomed_code,icd10_code,icd10_description
63198006,M94.241,"Chondromalacia, joints of right hand"
75467001,M50.00,"Cervical disc disorder with myelopathy, unspecified cervical region"
77489003,H11.011,Amyloid pterygium of right eye
60700002,H90.4,"Sensorineural hearing loss, unilateral with unrestricted hearing on the contralateral side"
10627751000119104,L02.424,Furuncle of left upper limb
10627791000119109,L02.423,Furuncle of right upper limb
10629791000119104,L03.112,Cellulitis of left axilla
10629831000119105,L03.111,Cellulitis of right axilla
10631151000119107,L03.124,Acute lymphangitis of left upper limb
10631191000119102,L03.123,Acute lymphangitis of right upper limb
10734651000119106,N60.21,Fibroadenosis of right breast
10735151000119100,N60.22,Fibroadenosis of left breast
10735191000119105,N60.41,Mammary duct ectasia of right breast
10735371000119106,N60.42,Mammary duct ectasia of left breast
10761241000119104,O60.1,Preterm labor with preterm delivery
1082551000119101,K11.22,Acute recurrent sialoadenitis
1087001000119105,A54.6,Gonococcal infection of anus and rectum
1088771000119102,H60.02,Abscess of left external ear
1088831000119107,H60.42,Cholesteatoma of left external ear
10898171000119108,S31.83,Open wound of anus
10904751000119100,S31.81,Open wound of right buttock
10904791000119105,S31.82,Open wound of left buttock
1091381000119105,H60.01,Abscess of right external ear
1091441000119107,H60.41,Cholesteatoma of right external ear
10960201000119101,S58.912D,"Complete traumatic amputation of left forearm, level unspecified, subsequent encounter"
10960241000119104,S58.911,"Complete traumatic amputation of right forearm, level unspecified"
111474003,P83,Other conditions of integument specific to newborn
11763011000119102,S86.022,Laceration of left Achilles tendon
11773371000119103,S60.311,Abrasion of right thumb
11773451000119101,S60.312,Abrasion of left thumb
11773531000119106,S60.410,Abrasion of right index finger
11776691000119101,S57.01,Crushing injury of right elbow
11776731000119108,S57.02,Crushing injury of left elbow
11779761000119107,S50.311,Abrasion of right elbow
11779801000119104,S50.312,Abrasion of left elbow
11785441000119107,S60.416,Abrasion of right little finger
11785481000119102,S60.412,Abrasion of right middle finger
11785521000119102,S60.414,Abrasion of right ring finger
11785601000119107,S60.411,Abrasion of left index finger
11785641000119109,S60.417,Abrasion of left little finger
11785681000119104,S60.413,Abrasion of left middle finger
11785721000119105,S60.415,Abrasion of left ring finger
11785761000119100,S60.511,Abrasion of right hand
11785801000119108,S60.512,Abrasion of left hand
11785841000119105,S60.811,Abrasion of right wrist
11785881000119100,S60.812,Abrasion of left wrist
11786801000119101,S77.01,Crushing injury of right hip
11786841000119104,S77.02,Crushing injury of left hip
11787121000119102,S60.457,Superficial foreign body of left little finger
11787201000119102,S60.455,Superficial foreign body of left ring finger
11787521000119109,S60.456,Superficial foreign body of right little finger
11787601000119104,S60.454,Superficial foreign body of right ring finger
11790721000119101,S77.11,Crushing injury of right thigh
11790761000119106,S77.12,Crushing injury of left thigh
11791001000119101,S80.12,Contusion of left lower leg
11791281000119103,T23.641A,"Corrosion of second degree of multiple right fingers (nail), including thumb, initial encounter"
11791321000119108,T23.642D,"Corrosion of second degree of multiple left fingers (nail), including thumb, subsequent encounter"
11791361000119103,S60.851,Superficial foreign body of right wrist
11791401000119107,S60.852,Superficial foreign body of left wrist
11794441000119107,S27.803,Laceration of diaphragm
11799361000119102,S35.411,Laceration of right renal artery
11799401000119106,S35.412,Laceration of left renal artery
11799731000119109,S35.514,Injury of right iliac vein
11799771000119107,S35.515,Injury of left iliac vein
11808411000119101,S36.533,Laceration of sigmoid colon
11823561000119100,S40.211,Abrasion of right shoulder
11823601000119100,S40.212,Abrasion of left shoulder
11823641000119103,S40.811,Abrasion of right upper arm
11823681000119108,S40.812,Abrasion of left upper arm
11824601000119103,S40.251,Superficial foreign body of right shoulder
11824681000119106,S40.252,Superficial foreign body of left shoulder
11843391000119101,S09.311,Primary blast injury of right ear
11843431000119106,S09.312,Primary blast injury of left ear
11843711000119106,S00.411,Abrasion of right ear
11843751000119107,S00.412,Abrasion of left ear
11844031000119101,S00.431,Contusion of right ear
11844071000119103,S00.432,Contusion of left ear
11844431000119109,S10.15,Superficial foreign body of throat
11847251000119105,S00.511,Abrasion of lip
11850481000119100,S20.01,Contusion of right breast
11850521000119100,S20.02,Contusion of left breast
11854011000119108,S93.502,Unspecified sprain of left great toe
11857341000119104,S86.021,Laceration of right Achilles tendon
12105701000119105,T23.042A,"Burn of unspecified degree of multiple left fingers (nail), including thumb, initial encounter"
12105741000119107,T23.441A,"Corrosion of unspecified degree of multiple right fingers (nail), including thumb, initial encounter"
125599006,S66.01,"Strain of long flexor muscle, fascia and tendon of thumb at wrist and hand level"
128133004,M94.229,"Chondromalacia, unspecified elbow"
128477000,L05.02,Pilonidal sinus with abscess
128869009,B86,Scabies
156035004,N91.0,Primary amenorrhea
156036003,N91.1,Secondary amenorrhea
15931461000119106,N83.01,Follicular cyst of right ovary
15931501000119106,N83.02,Follicular cyst of left ovary
15932461000119104,N83.522,Torsion of left fallopian tube
15932501000119104,N83.521,Torsion of right fallopian tube
15980431000119104,M26.632,Articular disc disorder of left temporomandibular joint
15980511000119105,M26.631,Articular disc disorder of right temporomandibular joint
16039191000119102,M94.212,"Chondromalacia, left shoulder"
16039391000119100,M94.211,"Chondromalacia, right shoulder"
16039431000119105,M94.252,"Chondromalacia, left hip"
16039631000119108,M94.251,"Chondromalacia, right hip"
16236701000119107,F13.931,"Sedative, hypnotic or anxiolytic use, unspecified with withdrawal delirium"
16294321000119104,N42.32,Atypical small acinar proliferation of prostate
16675201000119107,N50.811,Right testicular pain
16675301000119100,N50.812,Left testicular pain
16698651000119109,R31.21,Asymptomatic microscopic hematuria
16715971000119108,K55.02,Acute infarction of small intestine
16837681000119104,I21.A1,Myocardial infarction type 2
16907361000119100,H02.152,Paralytic ectropion of right lower eyelid
16907441000119106,H02.155,Paralytic ectropion of left lower eyelid
1763009,H16.3,Interstitial and deep keratitis
197980002,N43.0,Encysted hydrocele
201160005,L68.1,Acquired hypertrichosis lanuginosa
201219009,L70.4,Infantile acne
205237003,J69.1,Pneumonitis due to inhalation of oils and essences
207785000,S02,Fracture of skull and facial bones
209801006,S23.421,Sprain of chondrosternal joint
211946004,T23.442A,"Corrosion of unspecified degree of multiple left fingers (nail), including thumb, initial encounter"
219075006,T50.A25A,"Adverse effect of mixed bacterial vaccines without a pertussis component, initial encounter"
21987001,O63.2,"Delayed delivery of second twin, triplet, etc."
22925008,P83.9,"Condition of the integument specific to newborn, unspecified"
230672006,G70.2,Congenital and developmental myasthenia
234138005,E71.440,Ruvalcaba-Myhre-Smith syndrome
238496008,L05.02,Pilonidal sinus with abscess
239873007,M94.269,"Chondromalacia, unspecified knee"
239964003,M65.129,"Other infective (teno)synovitis, unspecified elbow"
240685007,A67.3,Mixed lesions of pinta
241937000,T88.6,Anaphylactic reaction due to adverse effect of correct drug or medicament properly administered
24864009,S93.502D,"Unspecified sprain of left great toe, subsequent encounter"
263028004,S83.10,Unspecified subluxation and dislocation of knee
263029007,S83.00,Unspecified subluxation and dislocation of patella
263058005,S83.01,Lateral subluxation and dislocation of patella
263128001,S53.429A,"Ulnohumeral (joint) sprain of unspecified elbow, initial encounter"
275382005,S06.316,Contusion and laceration of right cerebrum with loss of consciousness greater than 24 hours without return to pre-existing conscious level with patient surviving
292412001,T43.635D,"Adverse effect of methylphenidate, subsequent encounter"
293436009,T46.2X5D,"Adverse effect of other antidysrhythmic drugs, subsequent encounter"
304026004,I83.01,Varicose veins of right lower extremity with ulcer
309254003,L03.312,Cellulitis of back [any part except buttock]
312154004,M65.121,"Other infective (teno)synovitis, right elbow"
31295000,I80.213,"Phlebitis and thrombophlebitis of iliac vein, bilateral"
318691000119109,M94.271,"Chondromalacia, right ankle and joints of right foot"
323301000119109,M94.262,"Chondromalacia, left knee"
323321000119100,M94.261,"Chondromalacia, right knee"
328851000119107,T81.11,Postprocedural cardiogenic shock
330821000119100,H01.141,Xeroderma of right upper eyelid
330851000119108,H01.144,Xeroderma of left upper eyelid
330881000119101,H02.731,Vitiligo of right upper eyelid and periocular area
330911000119101,H02.734,Vitiligo of left upper eyelid and periocular area
331481000119108,H02.61,Xanthelasma of right upper eyelid
331651000119104,H02.831,Dermatochalasis of right upper eyelid
331671000119108,H02.011,Cicatricial entropion of right upper eyelid
332711000119103,H11.061,Recurrent pterygium of right eye
333431000119106,H05.231,Hemorrhage of right orbit
333471000119109,H05.221,Edema of right orbit
333491000119105,H05.811,Cyst of right orbit
334051000119107,H02.62,Xanthelasma of right lower eyelid
334091000119102,H02.042,Spastic entropion of right lower eyelid
334141000119109,H02.122,Mechanical ectropion of right lower eyelid
334221000119107,H02.832,Dermatochalasis of right lower eyelid
334241000119101,H02.012,Cicatricial entropion of right lower eyelid
334251000119104,H02.112,Cicatricial ectropion of right lower eyelid
334291000119109,H02.032,Senile entropion of right lower eyelid
334301000119105,H02.132,Senile ectropion of right lower eyelid
334701000119106,H16.391,"Other interstitial and deep keratitis, right eye"
335351000119105,H11.031,Double pterygium of right eye
336201000119108,H11.021,Central pterygium of right eye
337091000119107,H02.64,Xanthelasma of left upper eyelid
337261000119107,H02.834,Dermatochalasis of left upper eyelid
337281000119103,H02.014,Cicatricial entropion of left upper eyelid
338321000119109,H11.062,Recurrent pterygium of left eye
339041000119109,H05.232,Hemorrhage of left orbit
339081000119104,H05.222,Edema of left orbit
339101000119106,H05.812,Cyst of left orbit
339651000119100,H02.65,Xanthelasma of left lower eyelid
339691000119105,H02.045,Spastic entropion of left lower eyelid
339741000119107,H02.125,Mechanical ectropion of left lower eyelid
339821000119107,H02.835,Dermatochalasis of left lower eyelid
339841000119101,H02.015,Cicatricial entropion of left lower eyelid
339851000119104,H02.115,Cicatricial ectropion of left lower eyelid
339891000119109,H02.035,Senile entropion of left lower eyelid
339901000119108,H02.135,Senile ectropion of left lower eyelid
340301000119102,H16.392,"Other interstitial and deep keratitis, left eye"
340961000119102,H11.032,Double pterygium of left eye
341811000119103,H11.022,Central pterygium of left eye
342461000119105,H02.841,Edema of right upper eyelid
342471000119104,H02.842,Edema of right lower eyelid
342491000119103,H02.844,Edema of left upper eyelid
342501000119105,H02.845,Edema of left lower eyelid
342521000119101,H01.131,Eczematous dermatitis of right upper eyelid
342531000119103,H01.132,Eczematous dermatitis of right lower eyelid
342551000119109,H01.134,Eczematous dermatitis of left upper eyelid
342561000119106,H01.135,Eczematous dermatitis of left lower eyelid
345481000119105,H04.543,Stenosis of bilateral lacrimal canaliculi
345661000119104,H16.393,"Other interstitial and deep keratitis, bilateral"
346771000119109,H04.033,Chronic enlargement of bilateral lacrimal glands
348081000119109,H21.231,"Degeneration of iris (pigmentary), right eye"
348531000119101,H21.232,"Degeneration of iris (pigmentary), left eye"
349121000119101,H21.233,"Degeneration of iris (pigmentary), bilateral"
349401000119100,H04.551,Acquired stenosis of right nasolacrimal duct
349421000119109,H04.552,Acquired stenosis of left nasolacrimal duct
350821000119101,D24.2,Benign neoplasm of left breast
351151000119105,D31.02,Benign neoplasm of left conjunctiva
351291000119108,D30.21,Benign neoplasm of right ureter
351301000119109,D29.21,Benign neoplasm of right testis
351311000119107,D31.21,Benign neoplasm of right retina
351381000119101,D24.1,Benign neoplasm of right breast
351401000119101,D44.12,Neoplasm of uncertain behavior of left adrenal gland
351411000119103,D48.62,Neoplasm of uncertain behavior of left breast
351421000119105,D41.02,Neoplasm of uncertain behavior of left kidney
351501000119100,D39.12,Neoplasm of uncertain behavior of left ovary
351571000119105,D39.11,Neoplasm of uncertain behavior of right ovary
351581000119108,D41.22,Neoplasm of uncertain behavior of left ureter
351601000119104,D44.11,Neoplasm of uncertain behavior of right adrenal gland
351611000119101,D41.01,Neoplasm of uncertain behavior of right kidney
351641000119102,D41.21,Neoplasm of uncertain behavior of right ureter
351651000119100,D48.61,Neoplasm of uncertain behavior of right breast
353911000119105,D30.11,Benign neoplasm of right renal pelvis
353921000119103,D27.0,Benign neoplasm of right ovary
353961000119108,D30.01,Benign neoplasm of right kidney
354021000119100,D30.12,Benign neoplasm of left renal pelvis
354061000119105,D30.22,Benign neoplasm of left ureter
354071000119104,D31.22,Benign neoplasm of left retina
354091000119103,D27.1,Benign neoplasm of left ovary
354121000119104,D30.02,Benign neoplasm of left kidney
354141000119105,D29.32,Benign neoplasm of left epididymis
354161000119109,D29.22,Benign neoplasm of left testis
354181000119100,D29.31,Benign neoplasm of right epididymis
354201000119104,D31.01,Benign neoplasm of right conjunctiva
354341000119108,D05.02,Lobular carcinoma in situ of left breast
354471000119108,D05.01,Lobular carcinoma in situ of right breast
363175000,M65.129,"Other infective (teno)synovitis, unspecified elbow"
363179006,M65.129,"Other infective (teno)synovitis, unspecified elbow"
363346000,J91.0,Malignant pleural effusion
367338000,L30.3,Infective dermatitis
392133001,H21.23,Degeneration of iris (pigmentary)
392291006,H40.242,"Residual stage of angle-closure glaucoma, left eye"
394726009,L82,Seborrheic keratosis
398067003,A27.0,Leptospirosis icterohemorrhagica
402603005,L53.0,Toxic erythema
428724006,S83.11,Anterior subluxation and dislocation of proximal end of tibia
428861009,M94.25,"Chondromalacia, hip"
442652006,B81.0,Anisakiasis
443488001,C21,Malignant neoplasm of anus and anal canal
47639008,L05.9,Pilonidal cyst and sinus without abscess
48347002,J67.7,Air conditioner and humidifier lung
58320001,S83.01,Lateral subluxation and dislocation of patella
62014003,T46.6X5,Adverse effect of antihyperlipidemic and antiarteriosclerotic drugs
69047008,L56.1,Drug photoallergic response
722694005,D48.0,Neoplasm of uncertain behavior of bone and articular cartilage
733265007,T23.049D,"Burn of unspecified degree of unspecified multiple fingers (nail), including thumb, subsequent encounter"
733316000,H21.509,"Unspecified adhesions of iris and ciliary body, unspecified eye"
735492001,O66.0,Obstructed labor due to shoulder dystocia
735888004,S93.505A,"Unspecified sprain of left lesser toe(s), initial encounter"
737057000,M94.272,"Chondromalacia, left ankle and joints of left foot"
767303007,T57.2X,Toxic effect of manganese and its compounds
770414008,Q87.81,Alport syndrome
771083005,M79.62,Pain in upper arm
771411008,S93.504D,"Unspecified sprain of right lesser toe(s), subsequent encounter"
719955006,Q22.0,Pulmonary valve atresia
781000119106,E11.610,Type 2 diabetes mellitus with diabetic neuropathic arthropathy
782501005,F43.23,Adjustment disorder with mixed anxiety and depressed mood
782668007,D35.01,Benign neoplasm of right adrenal gland
784285002,R30.1,Vesical tenesmus
785308008,D68.311,Acquired hemophilia
78548001,D81.81,Biotin-dependent carboxylase deficiency
788954009,M85.2,Hyperostosis of skull
805601000000103,K55.3,Necrotizing enterocolitis
82300000,M94.279,"Chondromalacia, unspecified ankle and joints of foot"
8231007,H11.013,"Amyloid pterygium of eye, bilateral"
836424002,S93.33,Other subluxation and dislocation of foot
83839005,L40.2,Acrodermatitis continua
838524009,T43.641D,"Poisoning by ecstasy, accidental (unintentional), subsequent encounter"
838526006,T43.642A,"Poisoning by ecstasy, intentional self-harm, initial encounter"
840540008,T23.649A,"Corrosion of second degree of unspecified multiple fingers (nail), including thumb, initial encounter"
84494001,H40.159,"Residual stage of open-angle glaucoma, unspecified eye"
846626006,J68.2,"Upper respiratory inflammation due to chemicals, gases, fumes and vapors, not elsewhere classified"
846640007,J68.8,"Other respiratory conditions due to chemicals, gases, fumes and vapors"
858580008,E85.3,Secondary systemic amyloidosis
860614004,S34.21,Injury of nerve root of lumbar spine
860792009,J91.0,Malignant pleural effusion
860914002,N52.9,"Male erectile dysfunction, unspecified"
860915001,N52.2,Drug-induced erectile dysfunction
860951008,Q06.3,Other congenital cauda equina malformations
865890009,T17.21,Gastric contents in pharynx
865893006,T18.120,Food in esophagus causing compression of trachea
866106004,A50.31,Late congenital syphilitic interstitial keratitis
866109006,D72.111,Lymphocytic Variant Hypereosinophilic Syndrome [LHES]
870397000,H15.84,Scleral ectasia
870677001,T42.4X5,Adverse effect of benzodiazepines
871529001,T38.805A,"Adverse effect of unspecified hormones and synthetic substitutes, initial encounter"
871586006,J95.811,Postprocedural pneumothorax
871684001,T38.1X5,Adverse effect of thyroid hormones and substitutes
871702008,T42.0X5A,"Adverse effect of hydantoin derivatives, initial encounter"
871927008,Z91.03,Insect allergy status
93659005,C31.8,Malignant neoplasm of overlapping sites of accessory sinuses
95566004,N20.9,"Urinary calculus, unspecified"
771299009,P07.3,Preterm [premature] newborn [other]
71028008,P50.4,Newborn affected by hemorrhage into maternal circulation
237364002,P95,Stillbirth
15635291000119101,P07.38,"Preterm newborn, gestational age 35 completed weeks"
15635331000119107,P07.37,"Preterm newborn, gestational age 34 completed weeks"
15635371000119105,P07.36,"Preterm newborn, gestational age 33 completed weeks"
15635411000119106,P07.35,"Preterm newborn, gestational age 32 completed weeks"
15635451000119107,P07.34,"Preterm newborn, gestational age 31 completed weeks"
15750001000119103,P07.31,"Preterm newborn, gestational age 28 completed weeks"
15750041000119101,P07.32,"Preterm newborn, gestational age 29 completed weeks"
15750081000119106,P07.33,"Preterm newborn, gestational age 30 completed weeks"
15887011000119107,P07.23,"Extreme immaturity of newborn, gestational age 24 completed weeks"
15887051000119108,P07.24,"Extreme immaturity of newborn, gestational age 25 completed weeks"
15887131000119101,P07.26,"Extreme immaturity of newborn, gestational age 27 completed weeks"
310530008,P07.39,"Preterm newborn, gestational age 36 completed weeks"
395507008,P07.30,"Preterm newborn, unspecified weeks of gestation"
722840003,P07.22,"Extreme immaturity of newborn, gestational age 23 completed weeks"
882784691000119100,J12.82,Pneumonia due to coronavirus disease 2019
300161000119106,M35.89,Other specified systemic involvement of connective tissue
840546002,Z20.822,Contact with and (suspected) exposure to COVID-19
94899001,D38.0,Neoplasm of uncertain behavior of larynx
191169008,D58.1,Hereditary elliptocytosis
14223005,I85.00,Esophageal varices without bleeding
51599000,J38.4,Edema of larynx
40159009,Q18.4,Macrostomia
25479004,T17.200,Unspecified foreign body in pharynx causing asphyxiation
197130009,K91.0,Vomiting following gastrointestinal surgery
109369002,C32.8,Malignant neoplasm of overlapping sites of larynx
111546006,E31,Polyglandular dysfunction
95002008,D44.5,Neoplasm of uncertain behavior of pineal gland
70305005,M26.23,Excessive horizontal overlap
23387001,K22.3,Perforation of esophagus
52767006,P70.4,Other neonatal hypoglycemia
232403001,A56.4,Chlamydial infection of pharynx
15238002,K20.81,Other esophagitis with bleeding
11731003,Q18.3,Webbing of neck
16331000,R12,Heartburn
47609003,T18.100,Unspecified foreign body in esophagus causing compression of trachea
92175003,D14.1,Benign neoplasm of larynx
55355000,J06.0,Acute laryngopharyngitis
48128006,K11.0,Atrophy of salivary gland
11223009,Q38.8,Other congenital malformations of pharynx
69771008,Q39,Congenital malformations of esophagus
399244003,E23,Hypofunction and other disorders of the pituitary gland
191170009,D55.1,Anemia due to other disorders of glutathione metabolism
81680005,M54.2,Cervicalgia
111328001,Q38.7,Congenital pharyngeal pouch
262791003,S27.812,Contusion of esophagus (thoracic part)
19496008,S11.012,Laceration with foreign body of larynx
93964007,C75.1,Malignant neoplasm of pituitary gland
92091003,D13.0,Benign neoplasm of esophagus
61808009,E31.22,Multiple endocrine neoplasia [MEN] type IIA
17741008,J03,Acute tonsillitis
90460009,S19.80,Other specified injuries of unspecified part of neck
92044005,D35.5,Benign neoplasm of carotid body
92634009,D02.0,Carcinoma in situ of larynx
55995005,D58.0,Hereditary spherocytosis
28670008,I85.0,Esophageal varices
29951006,J37.0,Chronic laryngitis
75547007,J38.6,Stenosis of larynx
69825009,K11.6,Mucocele of salivary gland
363746003,J02,Acute pharyngitis
93843007,C25.4,Malignant neoplasm of endocrine pancreas
16402000,D57.3,Sickle-cell trait
109735001,K08.51,Open restoration margins of tooth
10890000,K11,Diseases of salivary glands
109835005,C15.8,Malignant neoplasm of overlapping sites of esophagus
30811009,K22.1,Ulcer of esophagus
371995001,C32,Malignant neoplasm of larynx
92263001,D10.4,Benign neoplasm of tonsil
60713008,T20.07,Burn of unspecified degree of neck
93962006,C75.3,Malignant neoplasm of pineal gland
10649000,E22,Hyperfunction of pituitary gland
57748001,K22.11,Ulcer of esophagus with bleeding
371984007,C15,Malignant neoplasm of esophagus
111551000,E29.1,Testicular hypofunction
140004,J31.2,Chronic pharyngitis
83271005,J37.1,Chronic laryngotracheitis
8765009,K92.0,Hematemesis
429975007,R13.11,"Dysphagia, oral phase"
73820008,E29,Testicular dysfunction
417425009,D57.0,Hb-SS disease with crisis
93740003,C75.4,Malignant neoplasm of carotid body
45982008,T28.1,Burn of esophagus
189473001,D44.7,Neoplasm of uncertain behavior of aortic body and other paraganglia
55602000,D81.4,Nezelof's syndrome
78948009,K11.7,Disturbances of salivary secretion
16932000,R11,Nausea and vomiting
95004009,D44.3,Neoplasm of uncertain behavior of pituitary gland
235599003,K20.0,Eosinophilic esophagitis
43878008,J02.0,Streptococcal pharyngitis
93961004,C14.0,"Malignant neoplasm of pharynx, unspecified"
92585006,D00.1,Carcinoma in situ of esophagus
92294001,D35.4,Benign neoplasm of pineal gland
30664006,E31.21,Multiple endocrine neoplasia [MEN] type I
195847009,J38.1,Polyp of vocal cord and larynx
38911009,D58,Other hereditary hemolytic anemias
267386008,E22.0,Acromegaly and pituitary gigantism
46689006,J35.1,Hypertrophy of tonsils
45338009,K11.1,Hypertrophy of salivary gland
75260002,K11.4,Fistula of salivary gland
17709002,I85.01,Esophageal varices with bleeding
20639004,B37.81,Candidal esophagitis
42982001,K11.2,Sialoadenitis
79740000,B37.0,Candidal stomatitis
50001009,S17.8,Crushing injury of other specified parts of neck
189362009,D37.03,Neoplasm of uncertain behavior of the major salivary glands
6655004,J04.0,Acute laryngitis
40261006,T20.37,Burn of third degree of neck
37031009,T75.3,Motion sickness
74372003,A54.5,Gonococcal pharyngitis
92293007,D10,Benign neoplasm of mouth and pharynx
266433003,K21.00,"Gastro-esophageal reflux disease with esophagitis, without bleeding"
28826002,K11.5,Sialolithiasis
253760004,Q39.3,Congenital stenosis and stricture of esophagus
46724008,E31.2,Multiple endocrine neoplasia [MEN] syndromes
92205005,D11,Benign neoplasm of major salivary glands
416180004,D57.1,Sickle-cell disease without crisis
16761005,K20.80,Other esophagitis without bleeding
29206004,E29.0,Testicular hyperfunction
40108008,D56,Thalassemia
75860007,J39.2,Other diseases of pharynx
109730006,K08.56,Poor aesthetic of existing restoration of tooth
372020000,C09,Malignant neoplasm of tonsil
64375000,J04.2,Acute laryngotracheitis
60600009,J38,"Diseases of vocal cords and larynx, not elsewhere classified"
80483009,K11.3,Abscess of salivary gland
72082009,M95.3,Acquired deformity of neck
35563005,K22.5,"Diverticulum of esophagus, acquired"
422587007,R11.0,Nausea
186729003,A56.0,Chlamydial infection of lower genitourinary tract
270505009,M12.1,Kaschin-Beck disease
267948008,M25.07,"Hemarthrosis, ankle and foot"
84445001,M25.69,"Stiffness of other specified joint, not elsewhere classified"
40884005,M25.41,"Effusion, shoulder"
29191005,M62.0,Separation of muscle (nontraumatic)
268005002,M67.5,Plica syndrome
298382003,M41,Scoliosis
203467005,M85.4,Solitary bone cyst
82062003,P83.5,Congenital hydrocele
43422002,S97.80,Crushing injury of unspecified foot
19684007,T24.021,Burn of unspecified degree of right knee
271331002,T69.021,"Immersion foot, right foot"
53664003,A54.41,Gonococcal spondylopathy
269485000,D24,Benign neoplasm of breast
269497004,D48.6,Neoplasm of uncertain behavior of breast
75047002,L97.105,Non-pressure chronic ulcer of unspecified thigh with muscle involvement without evidence of necrosis
